<?xml version="1.0" encoding="UTF-8"?>
<xs:schema xmlns:xs="http://www.w3.org/2001/XMLSchema" elementFormDefault="qualified">

    <xs:element name="cover_letter">
        <xs:complexType>
            <xs:sequence>
                <xs:element name="sender" type="t_person"/>
                <xs:element name="receiver" type="t_person"/>
                <xs:element name="paragraphs">
                    <xs:complexType>
                        <xs:sequence>
                            <xs:element maxOccurs="unbounded" name="paragraph" type="xs:string"/>
                        </xs:sequence>
                    </xs:complexType>
                </xs:element>
                <xs:element name="signature" type="xs:base64Binary"/>
            </xs:sequence>
        </xs:complexType>
    </xs:element>
    <xs:complexType name="t_person">
        <xs:sequence>
            <xs:element name="name" type="xs:string"/>
            <xs:element name="email" type="xs:string"/>
            <xs:element name="phone_number" type="xs:string"/>
            <xs:element name="institution" type="xs:string"/>
            <xs:element name="address" type="xs:string"/>
        </xs:sequence>
    </xs:complexType>
</xs:schema>
